{
  "id": "challenge-level-11-week-45-04-window-creation-surface-first-frame",
  "title": "Apply Window Creation, Surface Setup, and the First Frame",
  "categoryId": "level-11-android-internals-aosp",
  "lessonId": "level-11-week-45-04-window-creation-surface-first-frame",
  "difficulty": "expert",
  "estimatedMinutes": 60,
  "prompt": "Trace an activity from token and addWindow through traversal, buffer queue, SurfaceFlinger latch, composition, presentation, TTID, and TTDF.",
  "successCriteria": [
    "The start state, result, build, device, process or thread context, and public contract are explicit.",
    "Evidence follows the complete ownership path and distinguishes direct cause from nearby correlation.",
    "Failure, privacy, security, compatibility, regression, ownership, and recovery behavior are verified."
  ],
  "hints": [
    "Use matching AOSP or official documentation and two runtime evidence sources rather than memorising a diagram.",
    "Change one controlled condition and predict which process, thread, queue, service, or buffer evidence should move."
  ],
  "starterCode": {
    "language": "kotlin",
    "code": "reportFullyDrawn(); // Call only when the defined useful-content milestone is actually satisfied, then verify presentation in a system trace."
  },
  "solutionOutline": [
    "Draw the responsibility sequence and capture a version-matched baseline or failure reproduction.",
    "Exercise one adverse path, verify the causal fix or explanation, then preserve a regression guard and recovery record."
  ],
  "verification": [
    "Repeat the trace or telemetry capture from a documented starting state and retain raw evidence.",
    "Test death, delay, denial, cancellation, backpressure, or configuration as appropriate to the boundary."
  ],
  "rewards": {
    "xp": 140,
    "stars": 4
  },
  "version": "0.14.0"
}
