{
  "id": "challenge-level-06-week-26-06-travel-companion-capstone",
  "title": "Apply Capstone: Travel Companion",
  "categoryId": "level-06-android-platform-use-cases",
  "lessonId": "level-06-week-26-06-travel-companion-capstone",
  "difficulty": "advanced",
  "estimatedMinutes": 180,
  "prompt": "Deliver the local-first Travel Companion with justified platform integrations, explicit permission and fallback states, durable system-entry handling, adverse-scenario tests, and an evidence pack.",
  "successCriteria": [
    "Capability, permission, user education, and fallback states are explicit.",
    "Stable identity reconnects system results with current durable state after recreation.",
    "Adverse tests cover denial, cancellation, absence, duplication, interruption, and privacy."
  ],
  "hints": [
    "Write the user promise and fallback before calling the platform API.",
    "Test the callback after destroying the screen or process that launched it."
  ],
  "starterCode": {
    "language": "kotlin",
    "code": "interface TravelPlatform { val location: LocationCapability; val reminders: ReminderCapability; val media: CaptureCapability; val downloads: DownloadCapability; val widgetUpdates: WidgetCapability }"
  },
  "solutionOutline": [
    "Model capability and durable intent, then request the smallest user-controlled access.",
    "Validate returned data, clean resources, reconcile state, and record adverse evidence."
  ],
  "verification": [
    "Run deterministic state and contract tests.",
    "Exercise the feature on representative API levels and real hardware where required."
  ],
  "rewards": {
    "xp": 275,
    "stars": 5
  },
  "version": "0.9.0"
}
