{
  "id": "challenge-level-07-week-30-03-dependency-analysis-graph-hygiene",
  "title": "Apply Dependency Analysis and Graph Hygiene",
  "categoryId": "level-07-testing-quality-engineering",
  "lessonId": "level-07-week-30-03-dependency-analysis-graph-hygiene",
  "difficulty": "advanced",
  "estimatedMinutes": 55,
  "prompt": "Audit the release graph for unused, transitive, exposed, duplicate, vulnerable, and forbidden dependencies; document reviewed exceptions and verify the resulting APK.",
  "successCriteria": [
    "The check names the risk, observable promise, and fidelity requirement.",
    "Time, data, asynchronous work, external state, and cleanup are deterministic.",
    "Failure artifacts, execution trigger, owner, and intentional blind spots are documented."
  ],
  "hints": [
    "Move the check down a layer until any further move would lose necessary fidelity.",
    "Make the intended regression fail before trusting the new evidence."
  ],
  "starterCode": {
    "language": "kotlin",
    "code": "./gradlew :app:dependencies --configuration releaseRuntimeClasspath\n./gradlew dependencyInsight --dependency okhttp --configuration releaseRuntimeClasspath"
  },
  "solutionOutline": [
    "Model the risk, select the environment, and control all relevant variables.",
    "Assert behaviour, inject adverse cases, capture diagnostics, and document operations."
  ],
  "verification": [
    "Repeat in random order and isolation to prove determinism.",
    "Introduce the target defect and confirm the check fails with an actionable report."
  ],
  "rewards": {
    "xp": 115,
    "stars": 4
  },
  "version": "0.10.0"
}
