{
  "id": "challenge-level-10-week-43-01-structured-logging-event-taxonomy-redaction",
  "title": "Apply Structured Logging, Event Taxonomy, and Redaction",
  "categoryId": "level-10-performance-reliability-observability",
  "lessonId": "level-10-week-43-01-structured-logging-event-taxonomy-redaction",
  "difficulty": "advanced",
  "estimatedMinutes": 60,
  "prompt": "Define and test a 12-event schema for startup, sync, checkout, retry, and recovery, with field classification, redaction, sampling, retention, and user export.",
  "successCriteria": [
    "The start state, result, build, device, process or thread context, and public contract are explicit.",
    "Evidence follows the complete ownership path and distinguishes direct cause from nearby correlation.",
    "Failure, privacy, security, compatibility, regression, ownership, and recovery behavior are verified."
  ],
  "hints": [
    "Use matching AOSP or official documentation and two runtime evidence sources rather than memorising a diagram.",
    "Change one controlled condition and predict which process, thread, queue, service, or buffer evidence should move."
  ],
  "starterCode": {
    "language": "kotlin",
    "code": "logger.event(\"sync_finished\", fields = mapOf(\"result\" to result.category, \"attempt\" to attempt.coerceAtMost(9), \"correlation\" to correlation.redacted()))"
  },
  "solutionOutline": [
    "Draw the responsibility sequence and capture a version-matched baseline or failure reproduction.",
    "Exercise one adverse path, verify the causal fix or explanation, then preserve a regression guard and recovery record."
  ],
  "verification": [
    "Repeat the trace or telemetry capture from a documented starting state and retain raw evidence.",
    "Test death, delay, denial, cancellation, backpressure, or configuration as appropriate to the boundary."
  ],
  "rewards": {
    "xp": 140,
    "stars": 4
  },
  "version": "0.14.0"
}
