{
  "id": "challenge-level-09-week-37-05-gradle-testkit-functional-tests",
  "title": "Apply Gradle TestKit Functional Testing",
  "categoryId": "level-09-gradle-build-cicd",
  "lessonId": "level-09-week-37-05-gradle-testkit-functional-tests",
  "difficulty": "advanced",
  "estimatedMinutes": 60,
  "prompt": "Write TestKit tests for a convention plugin covering defaults, override, failure, UP_TO_DATE, FROM_CACHE, configuration cache and two Gradle versions.",
  "successCriteria": [
    "The task, variant or dependency model and expected artifact are explicit.",
    "Lazy inputs, outputs and dependencies behave correctly for changed, unchanged and failure paths.",
    "Functional tests plus performance, compatibility, security and rollback evidence are documented."
  ],
  "hints": [
    "Inspect the requested graph and resolved model before adding ordering or resolution rules.",
    "Test a second run and one meaningful input change; success once is insufficient."
  ],
  "starterCode": {
    "language": "kotlin",
    "code": "val result=GradleRunner.create().withProjectDir(fixture).withArguments(\"verifyQuality\",\"--configuration-cache\").withPluginClasspath().build()\nassertEquals(TaskOutcome.SUCCESS,result.task(\":verifyQuality\")?.outcome)"
  },
  "solutionOutline": [
    "Model the workflow with public typed APIs and complete data flow.",
    "Test clean, incremental, parallel/cached and failure behaviour, then measure the intended workflow."
  ],
  "verification": [
    "Run in a clean and relocated fixture plus the representative project workflow.",
    "Record task outcomes, generated artifact, critical path and regression guard."
  ],
  "rewards": {
    "xp": 125,
    "stars": 4
  },
  "version": "0.12.0"
}
