{
  "id": "challenge-level-07-week-30-05-api-binary-compatibility-validation",
  "title": "Apply API and Binary Compatibility Validation",
  "categoryId": "level-07-testing-quality-engineering",
  "lessonId": "level-07-week-30-05-api-binary-compatibility-validation",
  "difficulty": "advanced",
  "estimatedMinutes": 55,
  "prompt": "Enable ABI validation for a library module, classify intentional and accidental changes, test Kotlin and Java consumers, and define deprecation plus semantic-version policy.",
  "successCriteria": [
    "The check names the risk, observable promise, and fidelity requirement.",
    "Time, data, asynchronous work, external state, and cleanup are deterministic.",
    "Failure artifacts, execution trigger, owner, and intentional blind spots are documented."
  ],
  "hints": [
    "Move the check down a layer until any further move would lose necessary fidelity.",
    "Make the intended regression fail before trusting the new evidence."
  ],
  "starterCode": {
    "language": "kotlin",
    "code": "kotlin { abiValidation { enabled.set(true) } }\n// CI compares committed ABI dumps; reviewers approve intentional public changes."
  },
  "solutionOutline": [
    "Model the risk, select the environment, and control all relevant variables.",
    "Assert behaviour, inject adverse cases, capture diagnostics, and document operations."
  ],
  "verification": [
    "Repeat in random order and isolation to prove determinism.",
    "Introduce the target defect and confirm the check fails with an actionable report."
  ],
  "rewards": {
    "xp": 115,
    "stars": 4
  },
  "version": "0.10.0"
}
