{
  "id": "challenge-level-07-week-29-04-screenshot-matrix-screen-sizes-locales",
  "title": "Apply Screenshot Testing Across Screens, Themes, and Locales",
  "categoryId": "level-07-testing-quality-engineering",
  "lessonId": "level-07-week-29-04-screenshot-matrix-screen-sizes-locales",
  "difficulty": "advanced",
  "estimatedMinutes": 55,
  "prompt": "Create a minimal screenshot matrix for Travel Companion covering compact, tablet, RTL, large text, dark theme, error, and edge-to-edge, with deterministic goldens and review rules.",
  "successCriteria": [
    "The check names the risk, observable promise, and fidelity requirement.",
    "Time, data, asynchronous work, external state, and cleanup are deterministic.",
    "Failure artifacts, execution trigger, owner, and intentional blind spots are documented."
  ],
  "hints": [
    "Move the check down a layer until any further move would lose necessary fidelity.",
    "Make the intended regression fail before trusting the new evidence."
  ],
  "starterCode": {
    "language": "kotlin",
    "code": "@PreviewTest @Preview(widthDp=360,heightDp=800,locale=\"ar\",fontScale=1.5f)\n@Composable fun PaymentErrorGolden()=PaymentScreen(errorState)"
  },
  "solutionOutline": [
    "Model the risk, select the environment, and control all relevant variables.",
    "Assert behaviour, inject adverse cases, capture diagnostics, and document operations."
  ],
  "verification": [
    "Repeat in random order and isolation to prove determinism.",
    "Introduce the target defect and confirm the check fails with an actionable report."
  ],
  "rewards": {
    "xp": 115,
    "stars": 4
  },
  "version": "0.10.0"
}
