{
  "id": "challenge-level-08-week-33-03-pin-rotation-expiry-recovery-lab",
  "title": "Apply Certificate Rotation, Expiry, and Failure Recovery Lab",
  "categoryId": "level-08-android-security-engineering",
  "lessonId": "level-08-week-33-03-pin-rotation-expiry-recovery-lab",
  "difficulty": "advanced",
  "estimatedMinutes": 60,
  "prompt": "Given old, new, and emergency keys plus four installed app versions, produce and test a no-outage rotation timeline, rollback, monitoring, expiry, and compromise plan.",
  "successCriteria": [
    "The asset, attacker, boundary, abuse path, assumptions, and residual risk are explicit.",
    "The implementation enforces least privilege at the authoritative boundary and preserves safe failure.",
    "Adversarial tests plus rotation, revocation, migration, monitoring, recovery, and ownership are documented."
  ],
  "hints": [
    "Attempt the attack before and after the control so evidence demonstrates the intended property.",
    "Inspect the release artifact and server contract, not only source or UI behaviour."
  ],
  "starterCode": {
    "language": "kotlin",
    "code": "data class Compatibility(val app:String,val trusted:Set<String>,val served:Set<String>)\nfun compatible(x:Compatibility)=x.trusted.intersect(x.served).isNotEmpty()"
  },
  "solutionOutline": [
    "Create the threat and data-flow model, then select the narrowest sufficient control.",
    "Implement and attack the control, document limitations, and rehearse lifecycle and incident paths."
  ],
  "verification": [
    "Run bypass, replay/substitution, account-switch, failure, and recovery scenarios.",
    "Review evidence and residual risk with the owner who can accept or remediate it."
  ],
  "rewards": {
    "xp": 125,
    "stars": 4
  },
  "version": "0.11.0"
}
