{
  "id": "challenge-level-05-week-20-04-qualifiers-multibindings-assisted",
  "title": "Apply Qualifiers, Multibindings, and Assisted Factories",
  "categoryId": "level-05-production-architecture",
  "lessonId": "level-05-week-20-04-qualifiers-multibindings-assisted",
  "difficulty": "intermediate",
  "estimatedMinutes": 45,
  "prompt": "Provide public and authenticated HTTP clients with qualifiers, build a map of payment validators, and create an assisted statement exporter for a runtime account ID.",
  "successCriteria": [
    "Every important state and dependency has one named owner.",
    "Dependencies point through the smallest consumer-facing contracts.",
    "Tests, graph checks, or measurements cover the primary failure and change scenarios."
  ],
  "hints": [
    "Trace one user event end to end before drawing additional layers.",
    "Remove any wrapper that cannot name the change, risk, or test seam it protects."
  ],
  "starterCode": {
    "language": "kotlin",
    "code": "@Qualifier annotation class Authenticated\n\nclass StatementExporter @AssistedInject constructor(\n  private val store: StatementStore,\n  @Assisted private val accountId: AccountId\n)"
  },
  "solutionOutline": [
    "Model behaviours, lifetimes, dependencies, and failure states first.",
    "Implement the smallest boundary, compose it at the edge, and collect evidence."
  ],
  "verification": [
    "Run the focused behaviour or contract tests.",
    "Inspect the dependency graph and repeat the adverse scenario after recreation or replacement."
  ],
  "rewards": {
    "xp": 100,
    "stars": 4
  },
  "version": "0.8.0"
}
