{
  "id": "challenge-level-07-week-27-06-viewmodel-usecase-state-sequence-tests",
  "title": "Apply ViewModel and Use-Case State-Sequence Tests",
  "categoryId": "level-07-testing-quality-engineering",
  "lessonId": "level-07-week-27-06-viewmodel-usecase-state-sequence-tests",
  "difficulty": "advanced",
  "estimatedMinutes": 55,
  "prompt": "Write direct tests for a transfer ViewModel and SendPayment use case covering state sequences, duplicate events, saved input, repository recovery, rejection, and cancellation.",
  "successCriteria": [
    "The check names the risk, observable promise, and fidelity requirement.",
    "Time, data, asynchronous work, external state, and cleanup are deterministic.",
    "Failure artifacts, execution trigger, owner, and intentional blind spots are documented."
  ],
  "hints": [
    "Move the check down a layer until any further move would lose necessary fidelity.",
    "Make the intended regression fail before trusting the new evidence."
  ],
  "starterCode": {
    "language": "kotlin",
    "code": "vm.onAmountChanged(\"12.50\")\nvm.onSubmit()\nassertEquals(listOf(Editing,Submitting,Accepted),recorder.significantStates)"
  },
  "solutionOutline": [
    "Model the risk, select the environment, and control all relevant variables.",
    "Assert behaviour, inject adverse cases, capture diagnostics, and document operations."
  ],
  "verification": [
    "Repeat in random order and isolation to prove determinism.",
    "Introduce the target defect and confirm the check fails with an actionable report."
  ],
  "rewards": {
    "xp": 115,
    "stars": 4
  },
  "version": "0.10.0"
}
