{
  "id": "challenge-level-09-week-37-04-variant-aware-code-generation",
  "title": "Apply Variant-Aware Code Generation Tasks",
  "categoryId": "level-09-gradle-build-cicd",
  "lessonId": "level-09-week-37-04-variant-aware-code-generation",
  "difficulty": "advanced",
  "estimatedMinutes": 60,
  "prompt": "Create a per-variant route generator, register it through Android Components and prove deterministic incremental and cached behaviour.",
  "successCriteria": [
    "The task, variant or dependency model and expected artifact are explicit.",
    "Lazy inputs, outputs and dependencies behave correctly for changed, unchanged and failure paths.",
    "Functional tests plus performance, compatibility, security and rollback evidence are documented."
  ],
  "hints": [
    "Inspect the requested graph and resolved model before adding ordering or resolution rules.",
    "Test a second run and one meaningful input change; success once is insufficient."
  ],
  "starterCode": {
    "language": "kotlin",
    "code": "@CacheableTask abstract class GenerateRoutes:DefaultTask(){\n @get:InputFiles @get:PathSensitive(PathSensitivity.RELATIVE) abstract val schemas:ConfigurableFileCollection\n @get:OutputDirectory abstract val outputDir:DirectoryProperty\n @TaskAction fun run(){ /* deterministic atomic generation */ }\n}"
  },
  "solutionOutline": [
    "Model the workflow with public typed APIs and complete data flow.",
    "Test clean, incremental, parallel/cached and failure behaviour, then measure the intended workflow."
  ],
  "verification": [
    "Run in a clean and relocated fixture plus the representative project workflow.",
    "Record task outcomes, generated artifact, critical path and regression guard."
  ],
  "rewards": {
    "xp": 125,
    "stars": 4
  },
  "version": "0.12.0"
}
